{
  "$schema": "../../../STANDARD/schemas/candidate_event_briefs.schema.json",
  "schema_family": "candidate-event-briefs",
  "schema_version": "1.1.0",
  "project_id": "PRJ-006",
  "briefs": [
    {
      "candidate_id": "VAR-01",
      "candidate_selection_sha256": "0ede53a564d0b30bc5d454a5b86771cc277f5c258ce19165a1f3d3cee0793a1a",
      "primary_crime": "HOME_INVASION",
      "related_crimes": [],
      "core_action_type": "HOME_INVASION",
      "responsible_agent_structure": "COMPLICIT_GROUP",
      "victim_structure": "SINGLE_VICTIM",
      "offender_role_slots": [
        "OFFENDER-01",
        "OFFENDER-02",
        "OFFENDER-03"
      ],
      "victim_role_slots": [
        "VICTIM-01"
      ],
      "protagonist_role_slot": "PROTAGONIST-01",
      "relationship_context": "DATING_PARTNER",
      "target_selection_reason": "혼자 야간 꽃집을 정리하는 피해자의 일정과 열쇠 위치를 연인이 알고 있었다.",
      "initiating_context": "폐점 뒤 꽃집 안쪽에서 매번 다른 위치에 놓인 젖은 우산과 검은 흙이 발견된다.",
      "trigger_event": "피해자가 현관 잠금 실린더의 긁힘과 사라진 예비 열쇠를 함께 확인한다.",
      "motive_category": "CONTROL",
      "motive_summary": "연인은 이별을 막기 위해 공범들에게 침입과 감시를 맡겨 피해자의 독립을 꺾으려 한다.",
      "non_actionable_method_summary": "세 사람은 넘겨받은 접근 수단과 피해자의 부재 시간을 악용해 반복 침입한다.",
      "immediate_harm": "반복 침입으로 꽃집과 집이 안전한 공간이라는 믿음이 즉시 무너진다.",
      "lasting_harm": "보이지 않는 감시와 재침입 가능성 때문에 피해자는 일상 동선을 바꾸고 지속적인 공포를 겪는다.",
      "harms": [
        {
          "harm_id": "HARM-01",
          "classification": "SAFETY_COLLAPSE",
          "timing": "IMMEDIATE",
          "victim_role_slots": [
            "VICTIM-01"
          ],
          "summary": "반복 침입으로 꽃집과 집이 안전한 공간이라는 믿음이 즉시 무너진다."
        },
        {
          "harm_id": "HARM-02",
          "classification": "THREAT_OR_TRAUMA",
          "timing": "LASTING",
          "victim_role_slots": [
            "VICTIM-01"
          ],
          "summary": "보이지 않는 감시와 재침입 가능성 때문에 피해자는 일상 동선을 바꾸고 지속적인 공포를 겪는다."
        }
      ],
      "harm_ids": [
        "HARM-01",
        "HARM-02"
      ],
      "harm_classifications": [
        "SAFETY_COLLAPSE",
        "THREAT_OR_TRAUMA"
      ],
      "concealment_or_denial": "연인과 공범들은 꽃 배달 착오와 건물 점검을 핑계로 각 침입을 서로 무관한 우연처럼 꾸민다.",
      "discovery_path": "피해자는 우산의 흙, 열쇠고리 자국, 배달원 진술을 시간 순서로 겹쳐 세 사람의 역할을 분리한다.",
      "responsibility_path": "목격 진술과 현관 손상, 공범 간 메시지가 연인의 지시와 세 사람의 반복 접근을 함께 입증한다.",
      "central_pursuit_question": "누가 꽃집의 비상 열쇠를 이용해 반복 침입을 지휘했는가?",
      "development_functions": [
        {
          "development_function_id": "CDEV-001",
          "function_type": "REPEATED_ACCESS_OR_INTRUSION",
          "summary": "폐점 뒤 젖은 우산과 흙이 반복 침입의 간격을 드러낸다.",
          "required": true
        },
        {
          "development_function_id": "CDEV-002",
          "function_type": "SAFETY_COLLAPSE",
          "summary": "피해자는 꽃집과 집 양쪽에서 접근 흔적을 발견해 안전 기반을 잃는다.",
          "required": true
        },
        {
          "development_function_id": "CDEV-003",
          "function_type": "SAFETY_RESPONSE",
          "summary": "피해자는 배달원과 이웃의 기록을 모으고 혼자 폐점하지 않기로 결정한다.",
          "required": true
        },
        {
          "development_function_id": "CDEV-004",
          "function_type": "OFFENDER_RESPONSIBILITY",
          "summary": "공범 메시지와 물리 흔적이 연인의 지시 책임까지 연결한다.",
          "required": true
        }
      ],
      "reveal_targets": [
        {
          "reveal_target_id": "REVEAL-TARGET-01",
          "target_type": "CULPRIT",
          "summary": "젖은 우산의 주인 세 명과 지시자인 연인의 역할이 공개된다.",
          "planned_phase": "LATE",
          "planned_segment_id": null
        },
        {
          "reveal_target_id": "REVEAL-TARGET-02",
          "target_type": "MOTIVE",
          "summary": "이별을 막고 피해자의 독립을 통제하려는 동기가 드러난다.",
          "planned_phase": "LATE",
          "planned_segment_id": null
        },
        {
          "reveal_target_id": "REVEAL-TARGET-03",
          "target_type": "METHOD",
          "summary": "비상 열쇠와 폐점 일정을 나눠 쓴 반복 침입 구조가 밝혀진다.",
          "planned_phase": "LATE",
          "planned_segment_id": null
        },
        {
          "reveal_target_id": "REVEAL-TARGET-04",
          "target_type": "HARM_RESULT",
          "summary": "피해자의 안전 기반 붕괴와 지속적 공포가 범죄 결과로 확인된다.",
          "planned_phase": "LATE",
          "planned_segment_id": null
        }
      ],
      "truth_basis": {
        "source_truth_classification": "ORIGINAL_FICTION",
        "field_evidence": {
          "PRIMARY_CRIME": {
            "classification": "ORIGINAL_FICTION",
            "claim_ids": []
          },
          "CULPRIT": {
            "classification": "ORIGINAL_FICTION",
            "claim_ids": []
          },
          "MOTIVE": {
            "classification": "ORIGINAL_FICTION",
            "claim_ids": []
          },
          "METHOD": {
            "classification": "ORIGINAL_FICTION",
            "claim_ids": []
          },
          "HARM_RESULT": {
            "classification": "ORIGINAL_FICTION",
            "claim_ids": []
          },
          "LEGAL_OUTCOME": {
            "classification": "ORIGINAL_FICTION",
            "claim_ids": []
          }
        }
      }
    },
    {
      "candidate_id": "VAR-02",
      "candidate_selection_sha256": "82b8ed0f4c406460c7c9cb23071e3c3ce406bd9c4ba914f3b39efeb2c480b13d",
      "primary_crime": "DATING_VIOLENCE",
      "related_crimes": [
        "CONFINEMENT"
      ],
      "core_action_type": "CONFINEMENT",
      "responsible_agent_structure": "DUAL_AGENTS",
      "victim_structure": "MULTIPLE_VICTIMS",
      "offender_role_slots": [
        "OFFENDER-01",
        "OFFENDER-02"
      ],
      "victim_role_slots": [
        "VICTIM-01",
        "VICTIM-02"
      ],
      "protagonist_role_slot": "PROTAGONIST-01",
      "relationship_context": "DATING_PARTNER",
      "target_selection_reason": "연인은 피해자의 동생을 미끼로 삼으면 두 사람이 함께 약속 장소에 올 것을 알고 있었다.",
      "initiating_context": "화해를 위한 짐 정리 요청을 받고 자매가 비어 있는 아파트에 들어간다.",
      "trigger_event": "현관이 외부에서 다시 잠기고 연인의 친구가 복도에서 휴대전화를 회수한다.",
      "motive_category": "CONCEALMENT",
      "motive_summary": "두 가해자는 이전 폭력의 녹음 파일을 지우고 신고를 막기 위해 피해자들을 분리·감금한다.",
      "non_actionable_method_summary": "가해자들은 화해 요청과 접근 권한을 이용해 두 피해자의 퇴로와 연락을 차단한다.",
      "immediate_harm": "두 피해자는 외부 잠금으로 이동의 자유를 즉시 박탈당한다.",
      "lasting_harm": "한 피해자는 위협과 고립 이후 연인의 연락과 빈 집을 지속적으로 두려워한다.",
      "harms": [
        {
          "harm_id": "HARM-01",
          "classification": "LIBERTY_DEPRIVATION",
          "timing": "IMMEDIATE",
          "victim_role_slots": [
            "VICTIM-01",
            "VICTIM-02"
          ],
          "summary": "두 피해자는 외부 잠금으로 이동의 자유를 즉시 박탈당한다."
        },
        {
          "harm_id": "HARM-02",
          "classification": "THREAT_OR_TRAUMA",
          "timing": "LASTING",
          "victim_role_slots": [
            "VICTIM-01"
          ],
          "summary": "한 피해자는 위협과 고립 이후 연인의 연락과 빈 집을 지속적으로 두려워한다."
        }
      ],
      "harm_ids": [
        "HARM-01",
        "HARM-02"
      ],
      "harm_classifications": [
        "LIBERTY_DEPRIVATION",
        "THREAT_OR_TRAUMA"
      ],
      "concealment_or_denial": "두 가해자는 각자 상대가 문을 잠갔다고 주장하고 녹음 파일이 원래 없었다고 부인한다.",
      "discovery_path": "두 피해자의 서로 다른 기억, 복도 우편함의 손자국, 이웃의 문 닫힘 시각이 하나의 감금 순서로 맞춰진다.",
      "responsibility_path": "두 시점의 진술과 물리 흔적이 연인의 유인과 친구의 외부 잠금 역할을 각각 확정한다.",
      "central_pursuit_question": "두 피해자를 가둔 계획에서 연인과 친구는 어떤 역할을 나눴는가?",
      "development_functions": [
        {
          "development_function_id": "CDEV-001",
          "function_type": "LIBERTY_DEPRIVATION",
          "summary": "외부 잠금과 휴대전화 회수로 두 피해자의 이동과 연락이 차단된다.",
          "required": true
        },
        {
          "development_function_id": "CDEV-002",
          "function_type": "THREAT_AND_CHOICE_CONSTRAINT",
          "summary": "녹음 삭제를 거부하면 동생을 해치겠다는 압박이 선택을 제한한다.",
          "required": true
        },
        {
          "development_function_id": "CDEV-003",
          "function_type": "RESPONSE_OR_DISCOVERY",
          "summary": "자매가 벽 너머 소리로 행동 순서를 맞춰 탈출 신호를 만든다.",
          "required": true
        },
        {
          "development_function_id": "CDEV-004",
          "function_type": "HARM_OUTCOME",
          "summary": "구조 뒤에도 피해자의 공간 공포와 연락 회피가 지속된다.",
          "required": true
        },
        {
          "development_function_id": "CDEV-005",
          "function_type": "VIOLENCE_OR_THREAT",
          "summary": "과거 폭력 녹음과 현재 위협이 연속된 범죄 행동으로 드러난다.",
          "required": true
        },
        {
          "development_function_id": "CDEV-006",
          "function_type": "RELATIONSHIP_AND_POWER",
          "summary": "화해 요청과 친밀한 정보가 감금 권력으로 전환된다.",
          "required": true
        },
        {
          "development_function_id": "CDEV-007",
          "function_type": "RESPONSE_BARRIER",
          "summary": "피해자 분리와 연락 차단이 신고와 상호 확인을 막는다.",
          "required": true
        },
        {
          "development_function_id": "CDEV-008",
          "function_type": "VIOLENCE_OUTCOME",
          "summary": "구조 후 남은 공포와 신뢰 붕괴가 피해 결과로 확인된다.",
          "required": true
        }
      ],
      "reveal_targets": [
        {
          "reveal_target_id": "REVEAL-TARGET-01",
          "target_type": "CULPRIT",
          "summary": "연인과 친구가 유인과 잠금을 나눠 실행한 사실이 드러난다.",
          "planned_phase": "LATE",
          "planned_segment_id": null
        },
        {
          "reveal_target_id": "REVEAL-TARGET-02",
          "target_type": "MOTIVE",
          "summary": "이전 폭력의 녹음을 없애 신고를 막으려 한 동기가 확인된다.",
          "planned_phase": "LATE",
          "planned_segment_id": null
        },
        {
          "reveal_target_id": "REVEAL-TARGET-03",
          "target_type": "METHOD",
          "summary": "화해 요청, 피해자 분리, 외부 잠금의 역할 분담이 재구성된다.",
          "planned_phase": "LATE",
          "planned_segment_id": null
        },
        {
          "reveal_target_id": "REVEAL-TARGET-04",
          "target_type": "HARM_RESULT",
          "summary": "두 피해자의 자유 박탈과 한 피해자의 지속적 공포가 확인된다.",
          "planned_phase": "LATE",